# Set the environmental variables
# Stop server
# Copy the remote tablespace & DB zip files from suite location to working location.
# Check that the file exists in the working folder.
# Unzip the zip file.
# Remove the DOS based *.isl files from the MySql Data directory.
# Check that the *.ibd files are in the required location.
# Create new *.isl files with the correct path to the *.ibd files,
# Restart the DB server from unzip location Data Dir.
# Note that lower case option is required because the
# partition tables will be stored in mixed (Upper & Lower) format on Linux,
# but on Windows the partition table names are stored in lower case only.
# Restarting the server with skip-grant-tables and updating myblockchain.user
# table to deal with the restriction added to plugin value for users
# in WL6982.
Run myblockchain_upgrade once
myblockchain_upgrade: [ERROR] 1072: Key column 'Id' doesn't exist in table
myblockchain.columns_priv                                 OK
myblockchain.db                                           OK
myblockchain.engine_cost                                  OK
myblockchain.event                                        OK
myblockchain.func                                         OK
myblockchain.general_log                                  OK
myblockchain.gtid_executed                                OK
myblockchain.help_category                                OK
myblockchain.help_keyword                                 OK
myblockchain.help_relation                                OK
myblockchain.help_topic                                   OK
myblockchain.host                                         OK
myblockchain.innodb_index_stats                           OK
myblockchain.innodb_table_stats                           OK
myblockchain.ndb_binlog_index                             OK
myblockchain.plugin                                       OK
myblockchain.proc                                         OK
myblockchain.procs_priv                                   OK
myblockchain.proxies_priv                                 OK
myblockchain.server_cost                                  OK
myblockchain.servers                                      OK
myblockchain.slave_master_info                            OK
myblockchain.slave_relay_log_info                         OK
myblockchain.slave_worker_info                            OK
myblockchain.slow_log                                     OK
myblockchain.tables_priv                                  OK
myblockchain.time_zone                                    OK
myblockchain.time_zone_leap_second                        OK
myblockchain.time_zone_name                               OK
myblockchain.time_zone_transition                         OK
myblockchain.time_zone_transition_type                    OK
myblockchain.user                                         OK
sys.sys_config                                     OK
test.emp1                                          OK
test.emp2                                          OK
test.emp3                                          OK
test.emp4                                          OK
test.purchase                                      OK
# Stop server
# Check the DB & tables with DML statements.
use test;
SHOW CREATE TABLE emp1;
Table	Create Table
emp1	CREATE TABLE `emp1` (
  `empno` int(11) DEFAULT NULL,
  `ename` varchar(30) DEFAULT NULL,
  `sal` decimal(3,0) DEFAULT NULL
) ENGINE=InnoDB DEFAULT CHARSET=latin1
SHOW CREATE TABLE emp2;
Table	Create Table
emp2	CREATE TABLE `emp2` (
  `empno` int(11) DEFAULT NULL,
  `ename` varchar(30) DEFAULT NULL,
  `sal` decimal(3,0) DEFAULT NULL
) ENGINE=InnoDB DEFAULT CHARSET=latin1
/*!50100 PARTITION BY HASH (empno)
(PARTITION p1 DATA DIRECTORY = 'MYBLOCKCHAIN_TMP_DIR/myblockchaind.5980/tab1' ENGINE = InnoDB,
 PARTITION p2 DATA DIRECTORY = 'MYBLOCKCHAIN_TMP_DIR/myblockchaind.5980/tab2' ENGINE = InnoDB) */
SHOW CREATE TABLE emp3;
Table	Create Table
emp3	CREATE TABLE `emp3` (
  `empno` int(11) DEFAULT NULL,
  `ename` varchar(30) DEFAULT NULL,
  `sal` decimal(3,0) DEFAULT NULL
) ENGINE=InnoDB DEFAULT CHARSET=latin1 DATA DIRECTORY='MYBLOCKCHAIN_TMP_DIR/myblockchaind.5980/tab3/'
SHOW CREATE TABLE emp4;
Table	Create Table
emp4	CREATE TABLE `emp4` (
  `empno` int(11) DEFAULT NULL,
  `ename` varchar(30) DEFAULT NULL,
  `sal` decimal(3,0) DEFAULT NULL
) ENGINE=InnoDB DEFAULT CHARSET=latin1 ROW_FORMAT=DYNAMIC
/*!50100 PARTITION BY HASH (empno)
(PARTITION p1 DATA DIRECTORY = 'MYBLOCKCHAIN_TMP_DIR/myblockchaind.5980/tab4' ENGINE = InnoDB,
 PARTITION p2 DATA DIRECTORY = 'MYBLOCKCHAIN_TMP_DIR/myblockchaind.5980/tab5' ENGINE = InnoDB) */
SHOW CREATE TABLE purchase;
Table	Create Table
purchase	CREATE TABLE `purchase` (
  `id` int(11) DEFAULT NULL,
  `purchased` date DEFAULT NULL
) ENGINE=InnoDB DEFAULT CHARSET=latin1
/*!50100 PARTITION BY RANGE ( YEAR(purchased))
SUBPARTITION BY HASH ( TO_DAYS(purchased))
(PARTITION p0 VALUES LESS THAN (1990)
 (SUBPARTITION s0 DATA DIRECTORY = 'MYBLOCKCHAIN_TMP_DIR/myblockchaind.5980/part0' ENGINE = InnoDB,
  SUBPARTITION s1 DATA DIRECTORY = 'MYBLOCKCHAIN_TMP_DIR/myblockchaind.5980/part1' ENGINE = InnoDB),
 PARTITION p1 VALUES LESS THAN (2000)
 (SUBPARTITION s2 DATA DIRECTORY = 'MYBLOCKCHAIN_TMP_DIR/myblockchaind.5980/part2' ENGINE = InnoDB,
  SUBPARTITION s3 DATA DIRECTORY = 'MYBLOCKCHAIN_TMP_DIR/myblockchaind.5980/part3' ENGINE = InnoDB)) */
SELECT COUNT(*) FROM emp1;
COUNT(*)
2
SELECT COUNT(*) FROM emp2;
COUNT(*)
2
SELECT COUNT(*) FROM emp3;
COUNT(*)
2
SELECT COUNT(*) FROM emp4;
COUNT(*)
2
SELECT COUNT(*) FROM purchase;
COUNT(*)
1
DELETE  FROM emp1;
DELETE  FROM emp2;
DELETE  FROM emp3;
DELETE  FROM emp4;
DELETE FROM purchase;
SELECT COUNT(*) FROM emp1;
COUNT(*)
0
SELECT COUNT(*) FROM emp2;
COUNT(*)
0
SELECT COUNT(*) FROM emp3;
COUNT(*)
0
SELECT COUNT(*) FROM emp4;
COUNT(*)
0
SELECT COUNT(*) FROM purchase;
COUNT(*)
0
# Check the system tables have the proper entry of the tables.
=== information_schema.innodb_sys_tablespaces and innodb_sys_datafiles ===
Space_Name	Space_Type	Page_Size	Zip_Size	Formats_Permitted	Path
test/emp1	Single	DEFAULT	0	Compact or Redundant	.\test\emp1.ibd
test/emp2#p#p1	Single	DEFAULT	0	Compact or Redundant	MYBLOCKCHAIN_TMP_DIR/myblockchaind.5980/tab1/test/emp2#p#p1.ibd
test/emp2#p#p2	Single	DEFAULT	0	Compact or Redundant	MYBLOCKCHAIN_TMP_DIR/myblockchaind.5980/tab2/test/emp2#p#p2.ibd
test/emp3	Single	DEFAULT	0	Compact or Redundant	MYBLOCKCHAIN_TMP_DIR/myblockchaind.5980/tab3/test/emp3.ibd
test/purchase#p#p0#sp#s0	Single	DEFAULT	0	Compact or Redundant	MYBLOCKCHAIN_TMP_DIR/myblockchaind.5980/part0/test/purchase#p#p0#sp#s0.ibd
test/purchase#p#p0#sp#s1	Single	DEFAULT	0	Compact or Redundant	MYBLOCKCHAIN_TMP_DIR/myblockchaind.5980/part1/test/purchase#p#p0#sp#s1.ibd
test/purchase#p#p1#sp#s2	Single	DEFAULT	0	Compact or Redundant	MYBLOCKCHAIN_TMP_DIR/myblockchaind.5980/part2/test/purchase#p#p1#sp#s2.ibd
test/purchase#p#p1#sp#s3	Single	DEFAULT	0	Compact or Redundant	MYBLOCKCHAIN_TMP_DIR/myblockchaind.5980/part3/test/purchase#p#p1#sp#s3.ibd
test/emp4#p#p1	Single	DEFAULT	0	Dynamic	MYBLOCKCHAIN_TMP_DIR/myblockchaind.5980/tab4/test/emp4#p#p1.ibd
test/emp4#p#p2	Single	DEFAULT	0	Dynamic	MYBLOCKCHAIN_TMP_DIR/myblockchaind.5980/tab5/test/emp4#p#p2.ibd
=== information_schema.files ===
Space_Name	File_Type	Engine	Status	Tablespace_Name	Path
test/emp1	TABLESPACE	InnoDB	NORMAL	innodb_file_per_table.##	MYBLOCKCHAIND_DATADIR/test/emp1.ibd
test/emp2#p#p1	TABLESPACE	InnoDB	NORMAL	innodb_file_per_table.##	MYBLOCKCHAIN_TMP_DIR/myblockchaind.5980/tab1/test/emp2#p#p1.ibd
test/emp2#p#p2	TABLESPACE	InnoDB	NORMAL	innodb_file_per_table.##	MYBLOCKCHAIN_TMP_DIR/myblockchaind.5980/tab2/test/emp2#p#p2.ibd
test/emp3	TABLESPACE	InnoDB	NORMAL	innodb_file_per_table.##	MYBLOCKCHAIN_TMP_DIR/myblockchaind.5980/tab3/test/emp3.ibd
test/purchase#p#p0#sp#s0	TABLESPACE	InnoDB	NORMAL	innodb_file_per_table.##	MYBLOCKCHAIN_TMP_DIR/myblockchaind.5980/part0/test/purchase#p#p0#sp#s0.ibd
test/purchase#p#p0#sp#s1	TABLESPACE	InnoDB	NORMAL	innodb_file_per_table.##	MYBLOCKCHAIN_TMP_DIR/myblockchaind.5980/part1/test/purchase#p#p0#sp#s1.ibd
test/purchase#p#p1#sp#s2	TABLESPACE	InnoDB	NORMAL	innodb_file_per_table.##	MYBLOCKCHAIN_TMP_DIR/myblockchaind.5980/part2/test/purchase#p#p1#sp#s2.ibd
test/purchase#p#p1#sp#s3	TABLESPACE	InnoDB	NORMAL	innodb_file_per_table.##	MYBLOCKCHAIN_TMP_DIR/myblockchaind.5980/part3/test/purchase#p#p1#sp#s3.ibd
test/emp4#p#p1	TABLESPACE	InnoDB	NORMAL	innodb_file_per_table.##	MYBLOCKCHAIN_TMP_DIR/myblockchaind.5980/tab4/test/emp4#p#p1.ibd
test/emp4#p#p2	TABLESPACE	InnoDB	NORMAL	innodb_file_per_table.##	MYBLOCKCHAIN_TMP_DIR/myblockchaind.5980/tab5/test/emp4#p#p2.ibd
=== information_schema.innodb_sys_tables  and innodb_sys_tablespaces ===
Table Name	Tablespace	Table Flags	Columns	Row Format	Zip Size	Space Type
test/emp1	test/emp1	1	6	Compact	0	Single
test/emp2#p#p1	test/emp2#p#p1	65	6	Compact	0	Single
test/emp2#p#p2	test/emp2#p#p2	65	6	Compact	0	Single
test/emp3	test/emp3	65	6	Compact	0	Single
test/emp4#p#p1	test/emp4#p#p1	97	6	Dynamic	0	Single
test/emp4#p#p2	test/emp4#p#p2	97	6	Dynamic	0	Single
test/purchase#p#p0#sp#s0	test/purchase#p#p0#sp#s0	65	5	Compact	0	Single
test/purchase#p#p0#sp#s1	test/purchase#p#p0#sp#s1	65	5	Compact	0	Single
test/purchase#p#p1#sp#s2	test/purchase#p#p1#sp#s2	65	5	Compact	0	Single
test/purchase#p#p1#sp#s3	test/purchase#p#p1#sp#s3	65	5	Compact	0	Single
#
# Cleanup
#
DROP TABLE emp1;
DROP TABLE emp2;
DROP TABLE emp3;
DROP TABLE emp4;
DROP TABLE purchase;
CREATE DATABASE mtr;
CREATE PROCEDURE mtr.check_warnings(OUT result INT)
BEGIN
SELECT 0 INTO RESULT;
END|
