#
# Test with a saved MyISAM table from 4.1
#
# Everything _looks_ fine
SHOW CREATE TABLE t1;
Table	Create Table
t1	CREATE TABLE `t1` (
  `y2` year(2) DEFAULT NULL,
  `i` int(11) DEFAULT NULL,
  `i_chk` int(11) DEFAULT NULL,
  `y4` year(4) DEFAULT NULL,
  `y4_chk` year(4) DEFAULT NULL
) ENGINE=MyISAM DEFAULT CHARSET=latin1
Warnings:
Warning	1194	Found incompatible YEAR(x) field 'y2' in t1; Please do "ALTER TABLE `t1` FORCE" to fix it!
# Run CHECK TABLE, it should indicate table need a REPAIR TABLE
CHECK TABLE t1 FOR UPGRADE;
Table	Op	Msg_type	Msg_text
test.t1	check	warning	Table is marked as crashed
test.t1	check	error	Table upgrade required. Please do "REPAIR TABLE `t1`" or dump/reload to fix it!
SELECT * FROM t1;
ERROR HY000: Table 't1' is marked as crashed and should be repaired
INSERT INTO t1 () VALUES ();
ERROR HY000: Table 't1' is marked as crashed and should be repaired
INSERT INTO t1 (i) VALUES (10);
ERROR HY000: Table 't1' is marked as crashed and should be repaired
INSERT INTO t1 (y2) VALUES (10);
ERROR HY000: Table 't1' is marked as crashed and should be repaired
UPDATE t1 SET y2=10;
ERROR HY000: Table 't1' is marked as crashed and should be repaired
DELETE FROM t1 LIMIT 1;
ERROR HY000: Table 't1' is marked as crashed and should be repaired
CHECK TABLE t1 FOR UPGRADE;
Table	Op	Msg_type	Msg_text
test.t1	check	warning	Table is marked as crashed
test.t1	check	error	Table upgrade required. Please do "REPAIR TABLE `t1`" or dump/reload to fix it!
# Run REPAIR TABLE to alter the table and repair the YEAR(2) fields
REPAIR TABLE t1;
Table	Op	Msg_type	Msg_text
test.t1	repair	Warning	Found incompatible YEAR(x) field 'y2' in t1; Please do "ALTER TABLE `t1` FORCE" to fix it!
test.t1	repair	Warning	Found incompatible YEAR(x) field 'y2' in t1; Please do "ALTER TABLE `t1` FORCE" to fix it!
test.t1	repair	status	OK
# Now check it's back to normal
SHOW CREATE TABLE t1;
Table	Create Table
t1	CREATE TABLE `t1` (
  `y2` year(4) DEFAULT NULL,
  `i` int(11) DEFAULT NULL,
  `i_chk` int(11) DEFAULT NULL,
  `y4` year(4) DEFAULT NULL,
  `y4_chk` year(4) DEFAULT NULL
) ENGINE=MyISAM DEFAULT CHARSET=latin1
SELECT * FROM t1;
y2	i	i_chk	y4	y4_chk
1901	1901	1	1901	1901
2001	1	1	2001	2001
1970	1970	70	1970	1970
1970	70	70	1970	1970
2000	2000	0	2000	2000
0000	0	0	0000	0000
2069	2069	69	2069	2069
2069	69	69	2069	2069
2155	2155	55	2155	2155
2055	55	55	2055	2055
INSERT INTO t1 () VALUES ();
UPDATE t1 SET y2=10;
DELETE FROM t1 LIMIT 1;
DROP TABLE t1;
# ALTER TABLE ... FORCE should convert YEAR(2) to YEAR(4)
ALTER TABLE t1 FORCE;
Warnings:
Warning	1194	Found incompatible YEAR(x) field 'y2' in t1; Please do "ALTER TABLE `t1` FORCE" to fix it!
SHOW CREATE TABLE t1;
Table	Create Table
t1	CREATE TABLE `t1` (
  `y2` year(4) DEFAULT NULL,
  `i` int(11) DEFAULT NULL,
  `i_chk` int(11) DEFAULT NULL,
  `y4` year(4) DEFAULT NULL,
  `y4_chk` year(4) DEFAULT NULL
) ENGINE=MyISAM DEFAULT CHARSET=latin1
DROP TABLE t1;
#
# Test with a saved MyISAM table from 5.5
#
# Everything _looks_ fine
SHOW CREATE TABLE t1;
Table	Create Table
t1	CREATE TABLE `t1` (
  `y2` year(2) DEFAULT NULL,
  `i` int(11) DEFAULT NULL,
  `i_chk` int(11) DEFAULT NULL,
  `y4` year(4) DEFAULT NULL,
  `y4_chk` year(4) DEFAULT NULL
) ENGINE=MyISAM DEFAULT CHARSET=latin1
Warnings:
Warning	1194	Found incompatible YEAR(x) field 'y2' in t1; Please do "ALTER TABLE `t1` FORCE" to fix it!
# Run CHECK TABLE, it should indicate table need a REPAIR TABLE
CHECK TABLE t1 FOR UPGRADE;
Table	Op	Msg_type	Msg_text
test.t1	check	warning	Table is marked as crashed
test.t1	check	error	Table upgrade required. Please do "REPAIR TABLE `t1`" or dump/reload to fix it!
SELECT * FROM t1;
ERROR HY000: Table 't1' is marked as crashed and should be repaired
INSERT INTO t1 () VALUES ();
ERROR HY000: Table 't1' is marked as crashed and should be repaired
INSERT INTO t1 (i) VALUES (10);
ERROR HY000: Table 't1' is marked as crashed and should be repaired
INSERT INTO t1 (y2) VALUES (10);
ERROR HY000: Table 't1' is marked as crashed and should be repaired
UPDATE t1 SET y2=10;
ERROR HY000: Table 't1' is marked as crashed and should be repaired
DELETE FROM t1 LIMIT 1;
ERROR HY000: Table 't1' is marked as crashed and should be repaired
# Run REPAIR TABLE to alter the table and repair the YEAR(2) fields
REPAIR TABLE t1;
Table	Op	Msg_type	Msg_text
test.t1	repair	Warning	Found incompatible YEAR(x) field 'y2' in t1; Please do "ALTER TABLE `t1` FORCE" to fix it!
test.t1	repair	status	OK
# Now check it's back to normal
SHOW CREATE TABLE t1;
Table	Create Table
t1	CREATE TABLE `t1` (
  `y2` year(4) DEFAULT NULL,
  `i` int(11) DEFAULT NULL,
  `i_chk` int(11) DEFAULT NULL,
  `y4` year(4) DEFAULT NULL,
  `y4_chk` year(4) DEFAULT NULL
) ENGINE=MyISAM DEFAULT CHARSET=latin1
SELECT * FROM t1;
y2	i	i_chk	y4	y4_chk
1901	1901	1	1901	1901
2001	1	1	2001	2001
1970	1970	70	1970	1970
1970	70	70	1970	1970
2000	2000	0	2000	2000
0000	0	0	0000	0000
2069	2069	69	2069	2069
2069	69	69	2069	2069
2155	2155	55	2155	2155
2055	55	55	2055	2055
DROP TABLE t1;
# ALTER TABLE ... FORCE should convert YEAR(2) to YEAR(4)
SELECT * FROM t1;
ERROR HY000: Table 't1' is marked as crashed and should be repaired
INSERT INTO t1 () VALUES ();
ERROR HY000: Table 't1' is marked as crashed and should be repaired
INSERT INTO t1 (i) VALUES (10);
ERROR HY000: Table 't1' is marked as crashed and should be repaired
INSERT INTO t1 (y2) VALUES (10);
ERROR HY000: Table 't1' is marked as crashed and should be repaired
UPDATE t1 SET y2=10;
ERROR HY000: Table 't1' is marked as crashed and should be repaired
DELETE FROM t1 LIMIT 1;
ERROR HY000: Table 't1' is marked as crashed and should be repaired
ALTER TABLE t1 FORCE;
SHOW CREATE TABLE t1;
Table	Create Table
t1	CREATE TABLE `t1` (
  `y2` year(4) DEFAULT NULL,
  `i` int(11) DEFAULT NULL,
  `i_chk` int(11) DEFAULT NULL,
  `y4` year(4) DEFAULT NULL,
  `y4_chk` year(4) DEFAULT NULL
) ENGINE=MyISAM DEFAULT CHARSET=latin1
DROP TABLE t1;
#
# Test with InnoDB table (with fake .frm file)
#
# Create InnoDB table with YEAR(4) columns
SELECT * FROM t1;
ERROR HY000: Table 't1' is marked as crashed and should be repaired
INSERT INTO t1 () VALUES ();
ERROR HY000: Table 't1' is marked as crashed and should be repaired
INSERT INTO t1 (i) VALUES (10);
ERROR HY000: Table 't1' is marked as crashed and should be repaired
INSERT INTO t1 (y2) VALUES (10);
ERROR HY000: Table 't1' is marked as crashed and should be repaired
UPDATE t1 SET y2=10;
ERROR HY000: Table 't1' is marked as crashed and should be repaired
DELETE FROM t1 LIMIT 1;
ERROR HY000: Table 't1' is marked as crashed and should be repaired
SHOW WARNINGS;
Level	Code	Message
Error	1194	Table 't1' is marked as crashed and should be repaired
ALTER TABLE t1 ENGINE=InnoDB;
SHOW CREATE TABLE t1;
Table	Create Table
t1	CREATE TABLE `t1` (
  `y2` year(4) DEFAULT NULL,
  `i` int(11) DEFAULT NULL,
  `i_chk` int(11) DEFAULT NULL,
  `y4` year(4) DEFAULT NULL,
  `y4_chk` year(4) DEFAULT NULL
) ENGINE=InnoDB DEFAULT CHARSET=latin1
FLUSH TABLE t1;
# Replace YEAR(4) column metadata with YEAR(2) metadata
SHOW CREATE TABLE t1;
Table	Create Table
t1	CREATE TABLE `t1` (
  `y2` year(2) DEFAULT NULL,
  `i` int(11) DEFAULT NULL,
  `i_chk` int(11) DEFAULT NULL,
  `y4` year(4) DEFAULT NULL,
  `y4_chk` year(4) DEFAULT NULL
) ENGINE=InnoDB DEFAULT CHARSET=latin1
Warnings:
Warning	1194	Found incompatible YEAR(x) field 'y2' in t1; Please do "ALTER TABLE `t1` FORCE" to fix it!
# Run CHECK TABLE, it should indicate table need a REPAIR TABLE
CHECK TABLE t1 FOR UPGRADE;
Table	Op	Msg_type	Msg_text
test.t1	check	warning	Table is marked as crashed
test.t1	check	error	Table rebuild required. Please do "ALTER TABLE `t1` FORCE" or dump/reload to fix it!
# Run ALTER TABLE ... FORCE to alter the table and repair the YEAR(2) fields
ALTER TABLE t1 FORCE;
Warnings:
Warning	1194	Found incompatible YEAR(x) field 'y2' in t1; Please do "ALTER TABLE `t1` FORCE" to fix it!
SHOW CREATE TABLE t1;
Table	Create Table
t1	CREATE TABLE `t1` (
  `y2` year(4) DEFAULT NULL,
  `i` int(11) DEFAULT NULL,
  `i_chk` int(11) DEFAULT NULL,
  `y4` year(4) DEFAULT NULL,
  `y4_chk` year(4) DEFAULT NULL
) ENGINE=InnoDB DEFAULT CHARSET=latin1
DROP TABLE t1;
#
# Test myblockchain_upgrade tool
#
myblockchain.columns_priv                                 OK
myblockchain.db                                           OK
myblockchain.engine_cost                                  OK
myblockchain.event                                        OK
myblockchain.func                                         OK
myblockchain.general_log                                  OK
myblockchain.gtid_executed                                OK
myblockchain.help_category                                OK
myblockchain.help_keyword                                 OK
myblockchain.help_relation                                OK
myblockchain.help_topic                                   OK
myblockchain.innodb_index_stats                           OK
myblockchain.innodb_table_stats                           OK
myblockchain.ndb_binlog_index                             OK
myblockchain.plugin                                       OK
myblockchain.proc                                         OK
myblockchain.procs_priv                                   OK
myblockchain.proxies_priv                                 OK
myblockchain.server_cost                                  OK
myblockchain.servers                                      OK
myblockchain.slave_master_info                            OK
myblockchain.slave_relay_log_info                         OK
myblockchain.slave_worker_info                            OK
myblockchain.slow_log                                     OK
myblockchain.tables_priv                                  OK
myblockchain.time_zone                                    OK
myblockchain.time_zone_leap_second                        OK
myblockchain.time_zone_name                               OK
myblockchain.time_zone_transition                         OK
myblockchain.time_zone_transition_type                    OK
myblockchain.user                                         OK
mtr.global_suppressions                            OK
mtr.test_suppressions                              OK
sys.sys_config                                     OK
test.t1
warning  : Table is marked as crashed
Warning  : Found incompatible YEAR(x) field 'y2' in t1; Please do "ALTER TABLE `t1` FORCE" to fix it!
error    : Table upgrade required. Please do "REPAIR TABLE `t1`" or dump/reload to fix it!

Repairing tables
test.t1
Warning  : Found incompatible YEAR(x) field 'y2' in t1; Please do "ALTER TABLE `t1` FORCE" to fix it!
Warning  : Found incompatible YEAR(x) field 'y2' in t1; Please do "ALTER TABLE `t1` FORCE" to fix it!
status   : OK
SHOW CREATE TABLE t1;
Table	Create Table
t1	CREATE TABLE `t1` (
  `y2` year(4) DEFAULT NULL,
  `i` int(11) DEFAULT NULL,
  `i_chk` int(11) DEFAULT NULL,
  `y4` year(4) DEFAULT NULL,
  `y4_chk` year(4) DEFAULT NULL
) ENGINE=MyISAM DEFAULT CHARSET=latin1
DROP TABLE t1;
# 
